{
  "season": 2026,
  "week": 6,
  "generated_utc": "2026-10-13T17:35:39Z",
  "available": true,
  "reason": null,
  "source": "nflverse depth_charts_2026 (latest snapshot, pos_rank 1, OL + DL front) x ESPN injuries (data/injuries.json); annotation only, changes no number",
  "snapshot": "2026-10-13T14:58:07Z",
  "positions": {
    "ol": [
      "C",
      "G",
      "LG",
      "LT",
      "OG",
      "OL",
      "OT",
      "RG",
      "RT",
      "T"
    ],
    "dl": [
      "DE",
      "DL",
      "DT",
      "EDGE",
      "LDE",
      "LDT",
      "NT",
      "RDE",
      "RDT"
    ]
  },
  "teams": {
    "ARI": {
      "ol": {
        "starters": 5,
        "names": [
          "Jayden Williams",
          "Isaac Seumalo",
          "Hjalte Froholdt",
          "Jon Gaines II",
          "Elijah Wilkinson"
        ],
        "out": [],
        "doubtful": [],
        "questionable": []
      },
      "dl": {
        "starters": 4,
        "names": [
          "Josh Sweat",
          "Roy Lopez",
          "Walter Nolen III",
          "Dante Stills"
        ],
        "out": [],
        "doubtful": [],
        "questionable": []
      }
    },
    "ATL": {
      "ol": {
        "starters": 5,
        "names": [
          "Jake Matthews",
          "Matthew Bergeron",
          "Ryan Neuzil",
          "Chris Lindstrom",
          "Jawaan Taylor"
        ],
        "out": [],
        "doubtful": [],
        "questionable": [
          "Jake Matthews"
        ]
      },
      "dl": {
        "starters": 3,
        "names": [
          "LaCale London",
          "Gervon Dexter Sr.",
          "Brandon Dorlus"
        ],
        "out": [],
        "doubtful": [],
        "questionable": []
      }
    },
    "BAL": {
      "ol": {
        "starters": 5,
        "names": [
          "Ronnie Stanley",
          "John Simpson",
          "Cam Jurgens",
          "Olaivavega Ioane",
          "Roger Rosengarten"
        ],
        "out": [
          "Cam Jurgens"
        ],
        "doubtful": [],
        "questionable": []
      },
      "dl": {
        "starters": 3,
        "names": [
          "Nnamdi Madubuike",
          "Travis Jones",
          "Calais Campbell"
        ],
        "out": [],
        "doubtful": [],
        "questionable": []
      }
    },
    "BUF": {
      "ol": {
        "starters": 5,
        "names": [
          "Dion Dawkins",
          "Alec Anderson",
          "Connor McGovern",
          "O'Cyrus Torrence",
          "Spencer Brown"
        ],
        "out": [],
        "doubtful": [],
        "questionable": []
      },
      "dl": {
        "starters": 3,
        "names": [
          "T.J. Sanders",
          "Deone Walker",
          "Ed Oliver"
        ],
        "out": [
          "Ed Oliver"
        ],
        "doubtful": [],
        "questionable": []
      }
    },
    "CAR": {
      "ol": {
        "starters": 5,
        "names": [
          "Rasheed Walker",
          "Corey Bullock",
          "Luke Fortner",
          "Robert Hunt",
          "Monroe Freeling"
        ],
        "out": [],
        "doubtful": [],
        "questionable": [
          "Monroe Freeling"
        ]
      },
      "dl": {
        "starters": 3,
        "names": [
          "Derrick Brown",
          "Lee Hunter",
          "Bobby Brown III"
        ],
        "out": [],
        "doubtful": [],
        "questionable": []
      }
    },
    "CHI": {
      "ol": {
        "starters": 5,
        "names": [
          "Ozzy Trapilo",
          "Joe Thuney",
          "Garrett Bradbury",
          "Jonah Jackson",
          "Darnell Wright"
        ],
        "out": [
          "Ozzy Trapilo"
        ],
        "doubtful": [],
        "questionable": []
      },
      "dl": {
        "starters": 4,
        "names": [
          "Montez Sweat",
          "Grady Jarrett",
          "Kentavius Street",
          "Dayo Odeyingbo"
        ],
        "out": [],
        "doubtful": [],
        "questionable": [
          "Dayo Odeyingbo"
        ]
      }
    },
    "CIN": {
      "ol": {
        "starters": 5,
        "names": [
          "Orlando Brown Jr.",
          "Dylan Fairchild",
          "Ted Karras",
          "Dalton Risner",
          "Amarius Mims"
        ],
        "out": [],
        "doubtful": [],
        "questionable": []
      },
      "dl": {
        "starters": 4,
        "names": [
          "Boye Mafe",
          "Dexter Lawrence II",
          "Jonathan Allen",
          "Myles Murphy"
        ],
        "out": [],
        "doubtful": [],
        "questionable": []
      }
    },
    "CLE": {
      "ol": {
        "starters": 5,
        "names": [
          "Spencer Fano",
          "Zion Johnson",
          "Elgton Jenkins",
          "Teven Jenkins",
          "Tytus Howard"
        ],
        "out": [
          "Teven Jenkins"
        ],
        "doubtful": [],
        "questionable": [
          "Tytus Howard"
        ]
      },
      "dl": {
        "starters": 4,
        "names": [
          "Isaiah McGuire",
          "Mason Graham",
          "Maliek Collins",
          "Jared Verse"
        ],
        "out": [
          "Mason Graham"
        ],
        "doubtful": [],
        "questionable": []
      }
    },
    "DAL": {
      "ol": {
        "starters": 5,
        "names": [
          "Tyler Guyton",
          "Tyler Smith",
          "Cooper Beebe",
          "Tyler Booker",
          "Terence Steele"
        ],
        "out": [],
        "doubtful": [],
        "questionable": [
          "Tyler Guyton"
        ]
      },
      "dl": {
        "starters": 3,
        "names": [
          "Quinnen Williams",
          "Otito Ogbonnia",
          "Kenny Clark"
        ],
        "out": [],
        "doubtful": [],
        "questionable": []
      }
    },
    "DEN": {
      "ol": {
        "starters": 5,
        "names": [
          "Garett Bolles",
          "Ben Powers",
          "Luke Wattenberg",
          "Quinn Meinerz",
          "Mike McGlinchey"
        ],
        "out": [],
        "doubtful": [],
        "questionable": []
      },
      "dl": {
        "starters": 3,
        "names": [
          "Zach Allen",
          "D.J. Jones",
          "Eyioma Uwazurike"
        ],
        "out": [],
        "doubtful": [],
        "questionable": []
      }
    },
    "DET": {
      "ol": {
        "starters": 5,
        "names": [
          "Penei Sewell",
          "Christian Mahogany",
          "Juice Scruggs",
          "Tate Ratledge",
          "Blake Miller"
        ],
        "out": [],
        "doubtful": [],
        "questionable": []
      },
      "dl": {
        "starters": 4,
        "names": [
          "Aidan Hutchinson",
          "Alim McNeill",
          "Tyleik Williams",
          "Tyler Lacy"
        ],
        "out": [],
        "doubtful": [],
        "questionable": []
      }
    },
    "GB": {
      "ol": {
        "starters": 5,
        "names": [
          "Jordan Morgan",
          "Aaron Banks",
          "Sean Rhyan",
          "Travis Glover",
          "Anthony Belton"
        ],
        "out": [
          "Aaron Banks"
        ],
        "doubtful": [],
        "questionable": []
      },
      "dl": {
        "starters": 3,
        "names": [
          "Karl Brooks",
          "Jonathan Ford",
          "Devonte Wyatt"
        ],
        "out": [],
        "doubtful": [],
        "questionable": []
      }
    },
    "HOU": {
      "ol": {
        "starters": 5,
        "names": [
          "Aireontae Ersery",
          "Keylan Rutledge",
          "Evan Brown",
          "Ed Ingram",
          "Trent Brown"
        ],
        "out": [],
        "doubtful": [],
        "questionable": []
      },
      "dl": {
        "starters": 4,
        "names": [
          "Will Anderson Jr.",
          "Tommy Togiai",
          "Sheldon Rankins",
          "Danielle Hunter"
        ],
        "out": [],
        "doubtful": [],
        "questionable": []
      }
    },
    "IND": {
      "ol": {
        "starters": 5,
        "names": [
          "Bernhard Raimann",
          "Quenton Nelson",
          "Tanor Bortolini",
          "Matt Goncalves",
          "Jalen Travis"
        ],
        "out": [],
        "doubtful": [],
        "questionable": []
      },
      "dl": {
        "starters": 4,
        "names": [
          "Jaylahn Tuimoloau",
          "Grover Stewart",
          "DeForest Buckner",
          "Laiatu Latu"
        ],
        "out": [],
        "doubtful": [],
        "questionable": []
      }
    },
    "JAX": {
      "ol": {
        "starters": 5,
        "names": [
          "Anton Harrison",
          "Emmanuel Pregnon",
          "Robert Hainsey",
          "Ezra Cleveland",
          "Cole Van Lanen"
        ],
        "out": [],
        "doubtful": [],
        "questionable": [
          "Anton Harrison"
        ]
      },
      "dl": {
        "starters": 4,
        "names": [
          "Travon Walker",
          "Arik Armstead",
          "DaVon Hamilton",
          "Josh Hines-Allen"
        ],
        "out": [],
        "doubtful": [],
        "questionable": []
      }
    },
    "KC": {
      "ol": {
        "starters": 5,
        "names": [
          "Josh Simmons",
          "Kingsley Suamataia",
          "Creed Humphrey",
          "Trey Smith",
          "Kahlil Benson"
        ],
        "out": [],
        "doubtful": [],
        "questionable": [
          "Josh Simmons"
        ]
      },
      "dl": {
        "starters": 4,
        "names": [
          "George Karlaftis",
          "Chris Jones",
          "Khyiris Tonga",
          "Felix Anudike-Uzomah"
        ],
        "out": [],
        "doubtful": [],
        "questionable": []
      }
    },
    "LAC": {
      "ol": {
        "starters": 5,
        "names": [
          "Travis Burke",
          "Kayode Awosika",
          "Jake Slaughter",
          "Cole Strange",
          "Joe Alt"
        ],
        "out": [